0,1,2,3,4,5,6,7,8,9,10,11,12,13,14,15,16,17,18,19,20,21,22,23,24,25,26,27,28,29,30,31,32,33,34,35,36,37,38,39,40
Date & Hours,"Balance in hand founded by gauging through rader level transmitter and
 proving through Alcoholmeter",,,,,,,Receipts         of         Spirit ,,,,,,,,Increase in Sprit ,,Total quantity of Spirit,,,,Sprit issued to other VAT or Cask or Drum ,,,,,,,Sprit transferred thfough MFM-II for production ,,,,Closing balance left in VAT,,,,,,,
Date & Hours,Dip in CM,Temperature in Deg.C,"Indication in 
Alcoholmeter",Strength in % v/V,Volume in Bulk Litre ,Volume in Alcoholic Litre ,From Which Receiver ,Qty Received through Mass flow meter -I,Average Strength recorded by mass Flow Meter-I,Quantity received in A.L,From which VAT,total No. of Cask or Drum,Quantity in Bulk Litre ,Strength recorded by alcolommeter,Qty in Alcoholic Litre ,Operational Increase,Increase found during stock Audit,Dip recorded through Radar level transmitter ,Reading through RLT quantity in Bulk Litre ,Final Strength in % v/v,Qty in Alcoholic Litre ,Operational Wastage,Wastage found during stock Audit,Destination or VAT No ,Total Qty actually measured out by RLT,Strength of Spirit in % v/v,Quantity in Alcoholic Litre ,Number of VATs or total no. of cask or drum ,Qty Transferred in BL,Average Denity recorded by MFM-II,Strength recorded by MFM-II in %v/v,Quantity transferred in AL,Sprit left in the VAT after production as dead stock in AL,Final dip in CM. recorded through RLT,Final Volumn of spirit in bulk litre recorded through RLT,Strength in % v/v  ,Qty in Alcoholic Litre,Nature of operations to be noted in this column ,Remarks ,Intial of Excise officer in charge 
1,2,3,4,5,6,7,8,9,10,11,12,13,14,15,16,17,18,19,20,21,22,23,24,25,26,27,28,29,30,31,32,33,34,35,36,37,38,39,40,41
